{
  "$schema": "https://json-schema.org/draft/2020-12/schema",
  "$id": "https://raw.githubusercontent.com/teamleaderleo/proofwake/main/schema/repository-v1.schema.json",
  "title": "Proofwake repository policy v1",
  "type": "object",
  "additionalProperties": false,
  "required": ["version", "repository", "expectedSignals", "adapters"],
  "properties": {
    "$schema": {
      "const": "https://raw.githubusercontent.com/teamleaderleo/proofwake/main/schema/repository-v1.schema.json"
    },
    "version": { "const": 1 },
    "repository": {
      "type": "string",
      "maxLength": 200,
      "pattern": "^[A-Za-z0-9_.-]+/[A-Za-z0-9_.-]+$"
    },
    "lifecycle": { "enum": ["active", "dormant"] },
    "expectedSignals": {
      "type": "array",
      "maxItems": 32,
      "items": {
        "type": "object",
        "additionalProperties": false,
        "required": ["kind", "required", "staleAfterHours", "scope"],
        "properties": {
          "kind": {
            "enum": [
              "verify",
              "github-ci",
              "browser-review",
              "deployment",
              "service-check",
              "domain-check",
              "host-diagnostic",
              "local-diagnostic",
              "shadowbill-estimate"
            ]
          },
          "required": { "type": "boolean" },
          "staleAfterHours": { "type": "integer", "minimum": 0, "maximum": 8760 },
          "scope": {
            "enum": ["revision", "default-branch", "release", "deployment", "repository", "host"]
          }
        }
      }
    },
    "adapters": {
      "type": "object",
      "maxProperties": 16,
      "propertyNames": { "pattern": "^[a-z0-9][a-z0-9-]{0,63}$" },
      "additionalProperties": {
        "type": "string",
        "minLength": 1,
        "maxLength": 240,
        "pattern": "^(?!/)(?!.*(?:^|/)\\.{1,2}(?:/|$))[A-Za-z0-9._-]+(?:/[A-Za-z0-9._-]+)*$"
      }
    }
  }
}
